Unnamed: 0,time,title,Tuples,s,p,o,sp,po,spo,open price change,close price change
1184,20111004 6:30AM UTC,Starbucks profit-sharing to boost U.S. non-profits,"('Starbucks profit sharing', 'boost', 'U.S. non-profits')",Starbucks profit sharing,boost,U.S. non-profits,Starbucks profit sharing boost,boost U.S. non-profits,Starbucks profit sharing boost U.S. non-profits,-0.6449979999999975,0.5249999999999986
1185,20111009 11:34PM UTC,Starbucks close to cafe JV with Tata Coffee-report,"('Starbucks JV', 'is with', 'Tata Coffee report')",Starbucks JV,is with,Tata Coffee report,Starbucks JV is with,is with Tata Coffee report,Starbucks JV is with Tata Coffee report,0.5650010000000023,0.8300000000000018
1186,20111010 5:12PM UTC,"Starbucks may open 300 stores in Mexico, Argenina","('Starbucks', 'may open Argenina in', 'Mexico')",Starbucks,may open Argenina in,Mexico,Starbucks may open Argenina in,may open Argenina in Mexico,Starbucks may open Argenina in Mexico,0.5650010000000023,0.8300000000000018
1187,20111010 7:28AM UTC,Starbucks close to cafe JV with Tata Coffee: report,"('Starbucks JV', 'is with', 'Tata Coffee')",Starbucks JV,is with,Tata Coffee,Starbucks JV is with,is with Tata Coffee,Starbucks JV is with Tata Coffee,0.5650010000000023,0.8300000000000018
1188,20111012 3:54PM UTC,Starbucks Coffee Japan Continues its Dedication to Japan`s Relief and Recovery Efforts,"('Starbucks Coffee Japan', 'Continues to', 'Japan')",Starbucks Coffee Japan,Continues to,Japan,Starbucks Coffee Japan Continues to,Continues to Japan,Starbucks Coffee Japan Continues to Japan,0.5,0.0899979999999978
1189,20111012 1:10PM UTC,Starbucks VIA Ready Brew House Blend and Breakfast Blend Hit Grocery Shelves in the U.S.,"('Breakfast Blend', 'Hit Grocery Shelves in', 'U.S.')",Breakfast Blend,Hit,Grocery Shelves,Breakfast Blend Hit,Hit Grocery Shelves,Breakfast Blend Hit Grocery Shelves,0.5,0.0899979999999978
1190,20111013 7:21AM UTC,France-Starbucks retire une affichette conteste,"('France Starbucks', 'retire', 'affichette contest')",France Starbucks,retire,affichette contest,France Starbucks retire,retire affichette contest,France Starbucks retire affichette contest,-0.18499999999999872,-0.20999899999999627
1192,20111018 7:45PM UTC,Sol Casinos to Offer Starbucks Coffee Through Licensing Agreement,"('Sol Casinos', 'Offer Starbucks Coffee Through', 'Licensing Agreement')",Sol Casinos,Offer Starbucks Coffee Through,Licensing Agreement,Sol Casinos Offer Starbucks Coffee Through,Offer Starbucks Coffee Through Licensing Agreement,Sol Casinos Offer Starbucks Coffee Through Licensing Agreement,-0.35000100000000245,0.6450000000000031
1193,20111018 2:16PM UTC,"Starbucks adds lighter ""Blonde"" roast to lineup","('Starbucks', 'adds', 'roast')",Starbucks,adds,roast,Starbucks adds,adds roast,Starbucks adds roast,-0.35000100000000245,0.6450000000000031
1194,20111018 2:12PM UTC,UPDATE 2-Starbucks adds lighter 'Blonde' roast to lineup,"('UPDATE 2 Starbucks', 'adds', 'lighter Blonde roast')",UPDATE 2 Starbucks,adds,lighter Blonde roast,UPDATE 2 Starbucks adds,adds lighter Blonde roast,UPDATE 2 Starbucks adds lighter Blonde roast,-0.35000100000000245,0.6450000000000031
1196,20111018 1:13PM UTC,Starbucks adds lighter 'Blonde' roast to lineup,"('Starbucks', 'adds', 'roast')",Starbucks,adds,roast,Starbucks adds,adds roast,Starbucks adds roast,-0.35000100000000245,0.6450000000000031
1199,20111020 1:30PM UTC,Starbucks Announces Q4 and Fiscal Year End 2011 Results Conference Call,"('Starbucks', 'Announces', 'Q4 2011 Results Conference Call')",Starbucks,Announces,Q4 2011 Results Conference Call,Starbucks Announces,Announces Q4 2011 Results Conference Call,Starbucks Announces Q4 2011 Results Conference Call,-0.5450000000000017,0.0350020000000022
1203,20111025 12:14PM UTC,Starbucks Celebrates Its 500th Store Opening in Mainland China,"('Its 500th Store Opening', 'is in', 'Mainland China')",Its 500th Store Opening,is in,Mainland China,Its 500th Store Opening is in,is in Mainland China,Its 500th Store Opening is in Mainland China,0.10999999999999943,-0.630001
1204,20111026 3:12PM UTC,Worst California biker feud in decade erupted at Starbucks,"('Worst California biker feud', 'erupted at', 'Starbucks')",Worst California biker feud,erupted at,Starbucks,Worst California biker feud erupted at,erupted at Starbucks,Worst California biker feud erupted at Starbucks,-0.3500000000000014,0.06000200000000078
1207,20111102 1:29PM UTC,"Community Lender IFF Receives Grant from Starbucks and Opportunity Finance Network's ""Create Jobs for USA"" Program","('Community Lender IFF', ""Receives Program 's"", 'Opportunity Finance Network')",Community Lender IFF,Receives Program 's,Opportunity Finance Network,Community Lender IFF Receives Program 's,Receives Program 's Opportunity Finance Network,Community Lender IFF Receives Program 's Opportunity Finance Network,0.20999899999999982,-0.02499999999999858
1208,20111102 12:01AM UTC,Nearly 30 Million Starbucks Coffee K-Cup Portion Packs Hit U.S. Store Shelves This Week,"('Starbucks Coffee K Cup Portion Packs', 'Hit U.S. Store Shelves at_time', 'Week')",Starbucks Coffee K Cup Portion Packs,Hit U.S. Store Shelves at_time,Week,Starbucks Coffee K Cup Portion Packs Hit U.S. Store Shelves at_time,Hit U.S. Store Shelves at_time Week,Starbucks Coffee K Cup Portion Packs Hit U.S. Store Shelves at_time Week,0.20999899999999982,-0.02499999999999858
1213,20111108 5:44PM UTC,Starbucks to Present at Morgan Stanley Global Consumer Conference,"('Starbucks', 'Present at', 'Morgan Stanley Global Consumer Conference')",Starbucks,Present at,Morgan Stanley Global Consumer Conference,Starbucks Present at,Present at Morgan Stanley Global Consumer Conference,Starbucks Present at Morgan Stanley Global Consumer Conference,0.21500100000000089,0.06500000000000128
1214,20111108 9:02AM UTC, In Focus: Today's Trading Outlook - Featured Research on Marvell Technology Group Ltd. and Starbucks Corporation,"('Today', 'has', 'Trading Outlook Featured Research on Marvell Technology Group Ltd.')",Today,has,Trading Outlook Featured Research on Marvell Technology Group Ltd.,Today has,has Trading Outlook Featured Research on Marvell Technology Group Ltd.,Today has Trading Outlook Featured Research on Marvell Technology Group Ltd.,0.21500100000000089,0.06500000000000128
1215,20111108 9:00AM UTC, In Focus: Today's Trading Outlook - Featured Research on Marvell Technology Group Ltd. and Starbucks Corporation,"('Today', 'has', 'Trading Outlook Featured Research on Marvell Technology Group Ltd.')",Today,has,Trading Outlook Featured Research on Marvell Technology Group Ltd.,Today has,has Trading Outlook Featured Research on Marvell Technology Group Ltd.,Today has Trading Outlook Featured Research on Marvell Technology Group Ltd.,0.21500100000000089,0.06500000000000128
1216,20111108 6:00AM UTC,"China`s Leading Location-Based Social Mobile App, Jiepang Partners with Starbucks to Celebrate Christmas with ""Check-in"" Rewards at over 200 Stores in Eastern China","('China', '`s Leading', 'Jiepang Partners')",China,`s Leading,Jiepang Partners,China `s Leading,`s Leading Jiepang Partners,China `s Leading Jiepang Partners,0.21500100000000089,0.06500000000000128
1219,20111110 7:33PM UTC,HMSHost and Starbucks Coffee Company Celebrate 20 Years at Seattle-Tacoma International Airport,"('Starbucks Coffee Company', 'Celebrate', '20 Years')",Starbucks Coffee Company,Celebrate,20 Years,Starbucks Coffee Company Celebrate,Celebrate 20 Years,Starbucks Coffee Company Celebrate 20 Years,-0.08499899999999627,0.28500000000000014
1220,20111110 7:04PM UTC,Starbucks to open U.S. juice bars in 2012,"('Starbucks', 'open U.S. juice bars in', '2012')",Starbucks,open U.S. juice bars in,2012,Starbucks open U.S. juice bars in,open U.S. juice bars in 2012,Starbucks open U.S. juice bars in 2012,-0.08499899999999627,0.28500000000000014
1222,20111110 3:38PM UTC,Starbucks to open U.S. juice bars in 2012,"('Starbucks', 'open U.S. juice bars in', '2012')",Starbucks,open U.S. juice bars in,2012,Starbucks open U.S. juice bars in,open U.S. juice bars in 2012,Starbucks open U.S. juice bars in 2012,-0.08499899999999627,0.28500000000000014
1223,20111110 2:35PM UTC,Starbucks to open U.S. juice bars in 2012,"('Starbucks', 'open U.S. juice bars in', '2012')",Starbucks,open U.S. juice bars in,2012,Starbucks open U.S. juice bars in,open U.S. juice bars in 2012,Starbucks open U.S. juice bars in 2012,-0.08499899999999627,0.28500000000000014
1225,20111110 12:55PM UTC,Starbucks Acquires Evolution Fresh to Establish National Retail and Grocery Health and Wellness Brand,"('Evolution Fresh', 'Establish', 'National Retail')",Evolution Fresh,Establish,National Retail,Evolution Fresh Establish,Establish National Retail,Evolution Fresh Establish National Retail,-0.08499899999999627,0.28500000000000014
1226,20111110 12:50PM UTC,"Starbucks launching new chain, buys juice company","('Starbucks', 'launching', 'chain')",Starbucks,launching,chain,Starbucks launching,launching chain,Starbucks launching chain,-0.08499899999999627,0.28500000000000014
1227,20111110 12:50PM UTC,"Starbucks launching new chain, buys juice company","('Starbucks', 'launching', 'chain')",Starbucks,launching,chain,Starbucks launching,launching chain,Starbucks launching chain,-0.08499899999999627,0.28500000000000014
1228,20111111 8:50AM UTC,Starbucks to open U.S. juice bars in 2012,"('Starbucks', 'open U.S. juice bars in', '2012')",Starbucks,open U.S. juice bars in,2012,Starbucks open U.S. juice bars in,open U.S. juice bars in 2012,Starbucks open U.S. juice bars in 2012,0.34499999999999886,0.41000000000000014
1229,20111111 6:12AM UTC,Starbucks to open U.S. juice bars in 2012,"('Starbucks', 'open U.S. juice bars in', '2012')",Starbucks,open U.S. juice bars in,2012,Starbucks open U.S. juice bars in,open U.S. juice bars in 2012,Starbucks open U.S. juice bars in 2012,0.34499999999999886,0.41000000000000014
1230,20111114 9:41PM UTC,Starbucks to drop fee on smaller bags of coffee,"('Starbucks', 'drop fee on', 'bags')",Starbucks,drop fee on,bags,Starbucks drop fee on,drop fee on bags,Starbucks drop fee on bags,0.0799999999999983,-0.3500000000000014
1231,20111114 9:36PM UTC,Starbucks to drop fee on smaller bags of coffee,"('Starbucks', 'drop fee on', 'bags')",Starbucks,drop fee on,bags,Starbucks drop fee on,drop fee on bags,Starbucks drop fee on bags,0.0799999999999983,-0.3500000000000014
1232,20111114 9:01AM UTC, Europe Situation Forecasts Change - Report Highlights Starbucks Corporation and Green Mountain Coffee Roasters Inc.,"('Europe Situation Forecasts', 'Report', 'Highlights')",Europe Situation Forecasts,Report,Highlights,Europe Situation Forecasts Report,Report Highlights,Europe Situation Forecasts Report Highlights,0.0799999999999983,-0.3500000000000014
1233,20111114 9:00AM UTC, Europe Situation Forecasts Change - Report Highlights Starbucks Corporation and Green Mountain Coffee Roasters Inc.,"('Europe Situation Forecasts', 'Report', 'Highlights')",Europe Situation Forecasts,Report,Highlights,Europe Situation Forecasts Report,Report Highlights,Europe Situation Forecasts Report Highlights,0.0799999999999983,-0.3500000000000014
1234,20111115 6:42PM UTC,Starbucks raises prices in several key markets,"('Starbucks', 'raises prices in', 'several key markets')",Starbucks,raises prices in,several key markets,Starbucks raises prices in,raises prices in several key markets,Starbucks raises prices in several key markets,-0.3549999999999969,0.19499899999999926
1235,20111115 3:01AM UTC,"Starbucks Holiday Red Cups Come to Life, Signaling the Return of the Merriest Season","('Starbucks Holiday Red Cups', 'Come to', 'Signaling')",Starbucks Holiday Red Cups,Come to,Signaling,Starbucks Holiday Red Cups Come to,Come to Signaling,Starbucks Holiday Red Cups Come to Signaling,-0.3549999999999969,0.19499899999999926
1237,20111117 11:37PM UTC,Hagens Berman Investigates Starbucks Regarding Claims of Hidden Fees,"('Hagens Berman', 'Investigates', 'Starbucks Regarding Claims of Hidden Fees')",Hagens Berman,Investigates,Starbucks Regarding Claims of Hidden Fees,Hagens Berman Investigates,Investigates Starbucks Regarding Claims of Hidden Fees,Hagens Berman Investigates Starbucks Regarding Claims of Hidden Fees,-0.3549999999999969,-0.495001000000002
1238,20111117 7:00AM UTC,Starbucks Opens 500th Store in Latin America,"('Starbucks', 'Opens', 'Store')",Starbucks,Opens,Store,Starbucks Opens,Opens Store,Starbucks Opens Store,-0.3549999999999969,-0.495001000000002
1240,20111130 7:01PM UTC,"Starbucks to create 5,000 new UK jobs in next 5 years","('Starbucks', 'create', '5,000 new UK jobs')",Starbucks,create,"5,000 new UK jobs",Starbucks create,"create 5,000 new UK jobs","Starbucks create 5,000 new UK jobs",0.6000009999999989,0.634999999999998
1241,20111130 9:31AM UTC,"Critical Alerts for Chevron, Starbucks, F5 Networks, Citrix, and Fusion-io Released by Seven Summits Research","('Alerts', 'Released by', 'Seven Summits Research')",Alerts,Released by,Seven Summits Research,Alerts Released by,Released by Seven Summits Research,Alerts Released by Seven Summits Research,0.6000009999999989,0.634999999999998
1242,20111201 1:00AM UTC,"Starbucks to Create 5,000 Jobs in the U.K.","('Starbucks', 'Create', '5,000 Jobs')",Starbucks,Create,"5,000 Jobs",Starbucks Create,"Create 5,000 Jobs","Starbucks Create 5,000 Jobs",-0.010000999999999038,0.05500000000000327
1244,20111206 6:01AM UTC,Starbucks Mobile Transactions Exceed 26 Million Within First Year,"('Starbucks Mobile Transactions', 'Exceed', '26 Million')",Starbucks Mobile Transactions,Exceed,26 Million,Starbucks Mobile Transactions Exceed,Exceed 26 Million,Starbucks Mobile Transactions Exceed 26 Million,0.019999999999999574,-0.23500000000000298
1245,20111207 4:59PM UTC,Starbucks General Counsel and Secretary Announces Retirement,"('Secretary', 'Announces', 'Retirement')",Secretary,Announces,Retirement,Secretary Announces,Announces Retirement,Secretary Announces Retirement,-0.375,0.07500100000000387
1246,20111207 6:00AM UTC,"China`s Leading Location-Based Social Mobile App, Jiepang Partners With Starbucks to Tap Outdoor Media for Huge Christmas Check-in Promotion","('Based Social Mobile App', 'Tap Outdoor Media for', 'Christmas Check')",Based Social Mobile App,Tap Outdoor Media for,Christmas Check,Based Social Mobile App Tap Outdoor Media for,Tap Outdoor Media for Christmas Check,Based Social Mobile App Tap Outdoor Media for Christmas Check,-0.375,0.07500100000000387
1247,20111208 12:00PM UTC,Starbucks Enters Five New Cities Across Mainland China,"('Starbucks', 'Enters', 'Five New Cities Across Mainland China')",Starbucks,Enters,Five New Cities Across Mainland China,Starbucks Enters,Enters Five New Cities Across Mainland China,Starbucks Enters Five New Cities Across Mainland China,-0.04499999999999815,-0.5100010000000026
1248,20111214 4:05PM UTC,Starbucks Appoints Clara Shih to Board of Directors,"('Starbucks', 'Appoints Clara Shih to', 'Board of Directors')",Starbucks,Appoints Clara Shih to,Board of Directors,Starbucks Appoints Clara Shih to,Appoints Clara Shih to Board of Directors,Starbucks Appoints Clara Shih to Board of Directors,-0.5799999999999983,-0.259999999999998
1249,20111221 7:00AM UTC,China`s Leading Mobile Ad Platform Guohe Ad Partners with Starbucks to Deliver an Innovative Mobile Ad Campaign for a Massive Christmas Promotion,"('Starbucks', 'Deliver', 'Mobile Ad Campaign')",Starbucks,Deliver,Mobile Ad Campaign,Starbucks Deliver,Deliver Mobile Ad Campaign,Starbucks Deliver Mobile Ad Campaign,0.43999799999999567,0.08999999999999986
1250,20120103 3:57PM UTC,"Starbucks raises prices in U.S. Northeast, Sunbelt","('prices', 'is in', 'U.S. Northeast')",prices,is in,U.S. Northeast,prices is in,is in U.S. Northeast,prices is in U.S. Northeast,0.18499900000000125,-0.3599989999999984
1251,20120103 10:58AM UTC,Starbucks raises prices in Northeast and Sunbelt,"('Starbucks', 'raises', 'prices')",Starbucks,raises,prices,Starbucks raises,raises prices,Starbucks raises prices,0.18499900000000125,-0.3599989999999984
1252,20120103 10:02AM UTC,"Starbucks raising prices in US Northeast, Sunbelt","('Starbucks', 'raising prices in', 'US Northeast')",Starbucks,raising prices in,US Northeast,Starbucks raising prices in,raising prices in US Northeast,Starbucks raising prices in US Northeast,0.18499900000000125,-0.3599989999999984
1254,20120110 7:33PM UTC,"Starbucks lighter ""Blonde"" roasts debut in U.S.","('Starbucks lighter Blonde roasts debut', 'is in', 'U.S.')",Starbucks lighter Blonde roasts debut,is in,U.S.,Starbucks lighter Blonde roasts debut is in,is in U.S.,Starbucks lighter Blonde roasts debut is in U.S.,0.16000000000000014,0.11499999999999844
1255,20120110 5:13PM UTC,"Starbucks lighter ""Blonde"" roasts debut in U.S.","('Starbucks lighter Blonde roasts debut', 'is in', 'U.S.')",Starbucks lighter Blonde roasts debut,is in,U.S.,Starbucks lighter Blonde roasts debut is in,is in U.S.,Starbucks lighter Blonde roasts debut is in U.S.,0.16000000000000014,0.11499999999999844
1256,20120110 9:46AM UTC,"Starbucks lighter ""Blonde"" roasts debut in U.S.","('Starbucks lighter Blonde roasts debut', 'is in', 'U.S.')",Starbucks lighter Blonde roasts debut,is in,U.S.,Starbucks lighter Blonde roasts debut is in,is in U.S.,Starbucks lighter Blonde roasts debut is in U.S.,0.16000000000000014,0.11499999999999844
1257,20120110 6:53AM UTC,"Starbucks lighter ""Blonde"" roasts debut in U.S","('Starbucks lighter Blonde roasts debut', 'is in', 'U.S')",Starbucks lighter Blonde roasts debut,is in,U.S,Starbucks lighter Blonde roasts debut is in,is in U.S,Starbucks lighter Blonde roasts debut is in U.S,0.16000000000000014,0.11499999999999844
1259,20120111 5:15PM UTC,Starbucks Announces Q1 Fiscal Year 2012 Results Conference Call and Webcast,"('Q1 Fiscal Year 2012 Results Conference Call', 'Starbucks', 'Webcast')",Starbucks,Announces,Q1 Fiscal Year 2012 Results Conference Call,Starbucks Announces,Announces Q1 Fiscal Year 2012 Results Conference Call,Starbucks Announces Q1 Fiscal Year 2012 Results Conference Call,-0.2049999999999983,0.14999899999999755
1261,20120118 9:56AM UTC,"M&M; Productions to Commence Filming Initial Stages of Production of Reality Series ""Baristas"" Show Chronicles Drive Through Coffee Chain's Attempt to Compete With Starbucks by Casting Hot Young Girls as Servers","('Chronicles', 'Drive With', 'Starbucks')",Chronicles,Drive With,Starbucks,Chronicles Drive With,Drive With Starbucks,Chronicles Drive With Starbucks,-0.03999899999999812,0.16499999999999915
1263,20120119 7:39AM UTC,Starbucks closing in on retail deal with Tata Coffee,"('in retail deal', 'is with', 'Tata Coffee')",in retail deal,is with,Tata Coffee,in retail deal is with,is with Tata Coffee,in retail deal is with Tata Coffee,0.05999999999999872,-0.00999999999999801
1264,20120119 7:36AM UTC,Starbucks closing in on retail deal with Tata Coffee,"('in retail deal', 'is with', 'Tata Coffee')",in retail deal,is with,Tata Coffee,in retail deal is with,is with Tata Coffee,in retail deal is with Tata Coffee,0.05999999999999872,-0.00999999999999801
1265,20120123 3:52PM UTC,"Starbucks to sell beer, wine in Atlanta, Southern California","('beer', 'wine in', 'Atlanta')",beer,wine in,Atlanta,beer wine in,wine in Atlanta,beer wine in Atlanta,0.10500200000000248,-0.4050009999999986
1266,20120123 1:00PM UTC,Starbucks to Extend Evening Day-Part Concept,"('Starbucks', 'Extend', 'Evening Day Part Concept')",Starbucks,Extend,Evening Day Part Concept,Starbucks Extend,Extend Evening Day Part Concept,Starbucks Extend Evening Day Part Concept,0.10500200000000248,-0.4050009999999986
1267,20120123 11:07AM UTC,"Starbucks' ""Pro-Gun"" Policy Prompts Gun Victims' Advocate Group to Launch Nationwide Boycott on Valentine's Day 2012","('Valentine', 'on', 'Day 2012')",Valentine,on,Day 2012,Valentine on,on Day 2012,Valentine on Day 2012,0.10500200000000248,-0.4050009999999986
1269,20120124 9:06AM UTC,"Starbucks expanding beer, wine sales this year","('Starbucks', 'expanding', 'beer')",Starbucks,expanding,beer,Starbucks expanding,expanding beer,Starbucks expanding beer,-0.44500200000000234,0.1550009999999986
1271,20120124 7:02AM UTC,Cardiff International Announces That Starbucks Coffee Company Has Joined the Mission Tuition Merchant Coalition,"('Cardiff International', 'Announces', 'Starbucks Coffee Company')",Cardiff International,Announces,Starbucks Coffee Company,Cardiff International Announces,Announces Starbucks Coffee Company,Cardiff International Announces Starbucks Coffee Company,-0.44500200000000234,0.1550009999999986
1272,20120125 9:31AM UTC,"Critical Alerts for Starbucks, UnitedHealth, Harley Davidson, Life Technologies, and Vertex Pharmaceuticals Released by Seven Summits Research","('Alerts', 'Released by', 'Seven Summits Research')",Alerts,Released by,Seven Summits Research,Alerts Released by,Released by Seven Summits Research,Alerts Released by Seven Summits Research,0.41500100000000373,0.059999000000001246
1276,20120126 2:17PM UTC,Research and Markets: Starbucks Corp In Consumer Foodservice (World) - Company Profile 2012 - Use It to Understand Opportunities and Threats Facing the Business,"('Consumer Foodservice', 'In Corp is', 'Company Profile 2012')",Consumer Foodservice,In Corp is,Company Profile 2012,Consumer Foodservice In Corp is,In Corp is Company Profile 2012,Consumer Foodservice In Corp is Company Profile 2012,-0.01499899999999954,0.28500000000000014
1277,20120126 6:01AM UTC,"Diet Mountain Dew, Brisk and Starbucks Ready-To-Drink Beverages Grow to be Billion-Dollar Brands for PepsiCo","('Brisk Ready Beverages', 'Grow', 'Billion Dollar Brands for PepsiCo')",Brisk Ready Beverages,Grow,Billion Dollar Brands for PepsiCo,Brisk Ready Beverages Grow,Grow Billion Dollar Brands for PepsiCo,Brisk Ready Beverages Grow Billion Dollar Brands for PepsiCo,-0.01499899999999954,0.28500000000000014
1279,20120127 12:01AM UTC,Starbucks Exceeds Goals with More Than 100 Million Starbucks K-Cup Packs Shipped,"('Starbucks', 'Exceeds', 'Goals')",Starbucks,Exceeds,Goals,Starbucks Exceeds,Exceeds Goals,Starbucks Exceeds Goals,-0.08500100000000188,-0.24500100000000202
1280,20120130 5:39PM UTC,"RPT-UPDATE 2-Starbucks to enter India, targets 50 outlets by year-end","('2 Starbucks', 'enter', 'India')",2 Starbucks,enter,India,2 Starbucks enter,enter India,2 Starbucks enter India,-0.2600010000000026,0.31500099999999875
1281,20120130 1:17PM UTC,"Starbucks to enter India, targets 50 outlets by year-end","('Starbucks', 'enter', 'India')",Starbucks,enter,India,Starbucks enter,enter India,Starbucks enter India,-0.2600010000000026,0.31500099999999875
1283,20120130 9:27AM UTC,"Starbucks to enter India, targets 50 outlets by year-end","('Starbucks', 'enter', 'India')",Starbucks,enter,India,Starbucks enter,enter India,Starbucks enter India,-0.2600010000000026,0.31500099999999875
1285,20120130 7:41AM UTC,Starbucks to open first India outlet in Aug-Sept,"('Starbucks', 'open India outlet in', 'Aug Sept')",Starbucks,open India outlet in,Aug Sept,Starbucks open India outlet in,open India outlet in Aug Sept,Starbucks open India outlet in Aug Sept,-0.2600010000000026,0.31500099999999875
1286,20120130 6:26AM UTC,Starbucks to open first India outlet in Aug-Sept,"('Starbucks', 'open India outlet in', 'Aug Sept')",Starbucks,open India outlet in,Aug Sept,Starbucks open India outlet in,open India outlet in Aug Sept,Starbucks open India outlet in Aug Sept,-0.2600010000000026,0.31500099999999875
1288,20120130 6:01AM UTC,Starbucks in deal with Tata to open cafes in India,"('Starbucks', 'is in', 'deal with Tata to open in India')",Starbucks,is in,deal with Tata to open in India,Starbucks is in,is in deal with Tata to open in India,Starbucks is in deal with Tata to open in India,-0.2600010000000026,0.31500099999999875
1289,20120201 9:30AM UTC,"Zacks Bull and Bear of the Day Highlights: Caterpillar, Bank of America, Cosi, Panera Bread and Starbucks","('Caterpillar', 'Bank of', 'America')",Caterpillar,Bank of,America,Caterpillar Bank of,Bank of America,Caterpillar Bank of America,-0.09999999999999787,0.1600020000000022
1291,20120203 9:30AM UTC,"Zacks Bull and Bear of the Day Highlights: SLM, Darden Restaurants, Green Mountain Coffee Roasters, Peet's Coffee & Tea and Starbucks","('Peet', 'has', 'Coffee')",Peet,has,Coffee,Peet has,has Coffee,Peet has Coffee,-0.12999899999999798,0.33000000000000185
1292,20120206 9:00AM UTC,Starbucks to Partner with Ai Ni Group to Bring China`s Yunnan Coffee to the World,"('China `s Yunnan Coffee', 'Starbucks to', 'Partner')",Partner,is with,Ai Ni Group,Partner is with,is with Ai Ni Group,Partner is with Ai Ni Group,0.07499799999999723,-0.015000000000000568
1294,20120217 9:51AM UTC,"Zacks' Voice of the People Highlights Opportunities With Home Depot, Starbucks, Altria and Cincinnati Financial","(""Zacks ' Voice"", 'is With', 'Home Depot')",Zacks ' Voice,is With,Home Depot,Zacks ' Voice is With,is With Home Depot,Zacks ' Voice is With Home Depot,0.1549990000000001,-0.03500000000000014
1297,20120229 9:10AM UTC,"Chick-fil-A, Starbucks, and Subway Are Top Fast Food Chains in Customer Experience Ratings, According to New Temkin Group Research","('Subway Are Top Fast Food Chains', 'is in', 'Customer Experience Ratings')",Subway Are Top Fast Food Chains,is in,Customer Experience Ratings,Subway Are Top Fast Food Chains is in,is in Customer Experience Ratings,Subway Are Top Fast Food Chains is in Customer Experience Ratings,0.3150000000000013,-0.17499899999999613
1298,20120301 5:02PM UTC,Starbucks to Present at UBS Global Consumer Conference,"('Starbucks', 'Present at', 'UBS Global Consumer Conference')",Starbucks,Present at,UBS Global Consumer Conference,Starbucks Present at,Present at UBS Global Consumer Conference,Starbucks Present at UBS Global Consumer Conference,-0.08500100000000188,0.07499899999999826
