Unnamed: 0,time,title,Tuples,s,p,o,sp,po,spo,open price change,close price change
1749,20130823 10:00AM UTC,"Newtown Action Alliance, Moms Demand Action For Gun Sense In America, And National Gun Victims Action Council Urge Starbucks CEO Howard Schultz To Meet With Newtown Families, Ban Guns From Stores","('Gun Sense', 'is In', 'America')",Gun Sense,is In,America,Gun Sense is In,is In America,Gun Sense is In America,0.48999799999999283,0.035000000000003695
1750,20130826 6:42PM UTC,Starbucks to sell home-grown coffee to the Colombians,"('Starbucks', 'sell', 'coffee')",Starbucks,sell,coffee,Starbucks sell,sell coffee,Starbucks sell coffee,0.005001000000000033,-0.04500200000000376
1751,20130826 6:39PM UTC,Starbucks to sell home-grown coffee to the Colombians,"('Starbucks', 'sell', 'coffee')",Starbucks,sell,coffee,Starbucks sell,sell coffee,Starbucks sell coffee,0.005001000000000033,-0.04500200000000376
1754,20130826 3:00PM UTC,Starbucks Honors Colombian Coffee Heritage with Entry into Colombia Retail Market and Expanded Support for Farmers,"('Starbucks Honors Colombian Coffee Heritage', 'is with', 'Entry into Colombia Retail Market for Farmers')",Starbucks Honors Colombian Coffee Heritage,is with,Entry into Colombia Retail Market for Farmers,Starbucks Honors Colombian Coffee Heritage is with,is with Entry into Colombia Retail Market for Farmers,Starbucks Honors Colombian Coffee Heritage is with Entry into Colombia Retail Market for Farmers,0.005001000000000033,-0.04500200000000376
1756,20130830 11:33AM UTC,"Starbucks to get more Colombians drinking coffee, rival hopes","('Starbucks', 'get', 'more Colombians coffee')",Starbucks,get,more Colombians coffee,Starbucks get,get more Colombians coffee,Starbucks get more Colombians coffee,0.3249969999999962,-0.33000200000000746
1758,20130903 2:56PM UTC,Correction: Fitch Assigns Initial 'A-' IDR to Starbucks & Rates $750MM Proposed Notes 'A-',"('Fitch', ""Assigns IDR '"", '750MM Notes')",Fitch,Assigns IDR ',750MM Notes,Fitch Assigns IDR ',Assigns IDR ' 750MM Notes,Fitch Assigns IDR ' 750MM Notes,0.15999899999999911,0.5400010000000037
1759,20130903 12:23PM UTC,Fitch Assigns Initial 'A-' IDR to Starbucks & Rates $750MM Proposed Notes 'A-'; Outlook Stable,"('Fitch', ""Assigns IDR '"", '750MM Notes')",Fitch,Assigns IDR ',750MM Notes,Fitch Assigns IDR ',Assigns IDR ' 750MM Notes,Fitch Assigns IDR ' 750MM Notes,0.15999899999999911,0.5400010000000037
1760,20130903 12:01AM UTC,More Than 200 Million Sold: Fans Celebrate the Return of the Original Pumpkin Spice Latte at Starbucks,"('Fans', 'Celebrate', 'Return')",Fans,Celebrate,Return,Fans Celebrate,Celebrate Return,Fans Celebrate Return,0.15999899999999911,0.5400010000000037
1763,20130916 9:00AM UTC,Starbucks Unveils Two Iconic Flagship Stores in China,"('Starbucks', 'Unveils', 'Two Flagship Stores in China')",Starbucks,Unveils,Two Flagship Stores in China,Starbucks Unveils,Unveils Two Flagship Stores in China,Starbucks Unveils Two Flagship Stores in China,0.49000199999999694,-0.16500099999999662
1765,20130917 3:01PM UTC,"Starbucks Promotes Chief Financial Officer Troy Alstead to Chief Financial Officer and Group President, Global Business Services","('Starbucks', 'Promotes Chief Financial Officer Troy Alstead to', 'Global Business Services')",Starbucks,Promotes Chief Financial Officer Troy Alstead to,Global Business Services,Starbucks Promotes Chief Financial Officer Troy Alstead to,Promotes Chief Financial Officer Troy Alstead to Global Business Services,Starbucks Promotes Chief Financial Officer Troy Alstead to Global Business Services,-0.6549989999999966,0.40000100000000316
1766,20130917 8:01AM UTC,"Services Sector Announced Autumn Product Offerings and Net Sales Reports - Research Report on eBay, Amazon.com, Walmart, Starbucks, and Costco","('Services Sector', 'Announced Autumn Product Offerings on', 'eBay')",Services Sector,Announced Autumn Product Offerings on,eBay,Services Sector Announced Autumn Product Offerings on,Announced Autumn Product Offerings on eBay,Services Sector Announced Autumn Product Offerings on eBay,-0.6549989999999966,0.40000100000000316
1767,20130918 8:45PM UTC,ISRA: Starbucks' CEO Announces 'Open Season' On His Employees,"(""Starbucks ' CEO"", 'Announces', 'Season')",Starbucks ' CEO,Announces,Season,Starbucks ' CEO Announces,Announces Season,Starbucks ' CEO Announces Season,0.3099980000000002,0.6450010000000006
1768,20130918 4:05PM UTC,"COLUMN-Starbucks policy shift is small win for gun safety, big one for economic boycotts","('Starbucks policy shift', 'one for', 'boycotts')",Starbucks policy shift,one for,boycotts,Starbucks policy shift one for,one for boycotts,Starbucks policy shift one for boycotts,0.3099980000000002,0.6450010000000006
1769,20130918 3:57PM UTC,"Starbucks policy shift is small win for gun safety, big one for economic boycotts","('small win', 'one for', 'economic boycotts')",small win,one for,economic boycotts,small win one for,one for economic boycotts,small win one for economic boycotts,0.3099980000000002,0.6450010000000006
1770,20130918 3:49PM UTC,"Starbucks policy shift is small win for gun safety, big one for economic boycotts","('small win', 'one for', 'economic boycotts')",small win,one for,economic boycotts,small win one for,one for economic boycotts,small win one for economic boycotts,0.3099980000000002,0.6450010000000006
1771,20130918 1:39PM UTC,Starbucks asks U.S. customers to leave guns at home,"('Starbucks', 'asks', 'U.S. customers')",Starbucks,asks,U.S. customers,Starbucks asks,asks U.S. customers,Starbucks asks U.S. customers,0.3099980000000002,0.6450010000000006
1772,20130918 1:32PM UTC,UPDATE 2-Starbucks asks U.S. customers to leave guns at home,"('UPDATE Starbucks', 'asks', 'U.S. customers')",UPDATE Starbucks,asks,U.S. customers,UPDATE Starbucks asks,asks U.S. customers,UPDATE Starbucks asks U.S. customers,0.3099980000000002,0.6450010000000006
1773,20130918 5:17AM UTC,Starbucks asks U.S. customers to leave guns at home,"('Starbucks', 'asks', 'U.S. customers')",Starbucks,asks,U.S. customers,Starbucks asks,asks U.S. customers,Starbucks asks U.S. customers,0.3099980000000002,0.6450010000000006
1774,20130918 1:59AM UTC,Moms Demand Action For Gun Sense In America Successfully Pressures Starbucks To Stop Allowing Guns In Stores,"('Gun Sense', 'is In', 'America')",Gun Sense,is In,America,Gun Sense is In,is In America,Gun Sense is In America,0.3099980000000002,0.6450010000000006
1775,20130918 1:24AM UTC,"Starbucks changes course, asks U.S. patrons to leave guns at home","('U.S. patrons', 'leave guns at', 'home')",U.S. patrons,leave guns at,home,U.S. patrons leave guns at,leave guns at home,U.S. patrons leave guns at home,0.3099980000000002,0.6450010000000006
1779,20130920 9:38PM UTC,Guantanamo hearing ends without ruling on 'Starbucks solution',"('Guantanamo hearing', 'ends without', 'ruling')",Guantanamo hearing,ends without,ruling,Guantanamo hearing ends without,ends without ruling,Guantanamo hearing ends without ruling,-0.6299969999999959,-0.11499799999999993
1780,20130920 9:37PM UTC,Guantanamo hearing ends without ruling on 'Starbucks solution',"('Guantanamo hearing', 'ends without', 'ruling')",Guantanamo hearing,ends without,ruling,Guantanamo hearing ends without,ends without ruling,Guantanamo hearing ends without ruling,-0.6299969999999959,-0.11499799999999993
1781,20130924 12:01AM UTC,"Starbucks Honors the Birthplace of Coffee with Ethiopia, an Extraordinary New Coffee Steeped in History & Flavor","('Starbucks Honors', 'is with', 'Ethiopia')",Starbucks Honors,is with,Ethiopia,Starbucks Honors is with,is with Ethiopia,Starbucks Honors is with Ethiopia,-0.29000100000000373,0.5950020000000009
1785,20131007 8:21PM UTC,Starbucks founder urges CEOs to push for end to federal shutdown,"('CEOs', 'push for', 'end')",CEOs,push for,end,CEOs push for,push for end,CEOs push for end,-0.10000300000000095,-0.2700010000000006
1786,20131007 8:17PM UTC,Starbucks founder urges CEOs to push for end to federal shutdown,"('CEOs', 'push for', 'end')",CEOs,push for,end,CEOs push for,push for end,CEOs push for end,-0.10000300000000095,-0.2700010000000006
1788,20131008 10:00AM UTC,Starbucks Offers Even More Choices and Benefits to My Starbucks Rewards Members,"('More Choices', 'Starbucks', 'Benefits')",N,o,n,N o,o n,N o n,0.25500100000000003,-0.6650010000000037
1789,20131010 3:04PM UTC,Starbucks CEO starts petition against government shutdown,"('Starbucks CEO', 'starts', 'petition')",Starbucks CEO,starts,petition,Starbucks CEO starts,starts petition,Starbucks CEO starts petition,0.45000000000000284,0.9299999999999997
1790,20131010 3:01PM UTC,Starbucks CEO starts petition against government shutdown,"('Starbucks CEO', 'starts', 'petition')",Starbucks CEO,starts,petition,Starbucks CEO starts,starts petition,Starbucks CEO starts petition,0.45000000000000284,0.9299999999999997
1791,20131011 2:06AM UTC,Starbucks CEO starts petition against government shutdown,"('Starbucks CEO', 'starts', 'petition')",Starbucks CEO,starts,petition,Starbucks CEO starts,starts petition,Starbucks CEO starts petition,0.4650010000000009,0.34999899999999684
1792,20131011 1:33AM UTC,UPDATE 1-Starbucks CEO starts petition against government shutdown,"('UPDATE Starbucks CEO', 'starts', 'petition')",UPDATE Starbucks CEO,starts,petition,UPDATE Starbucks CEO starts,starts petition,UPDATE Starbucks CEO starts petition,0.4650010000000009,0.34999899999999684
1793,20131015 6:37PM UTC,Starbucks Come Together Petition Approaches 2 Million Signatures and Counting,"('Petition Approaches', 'Starbucks', 'Counting')",Starbucks,Come,Petition Approaches,Starbucks Come,Come Petition Approaches,Starbucks Come Petition Approaches,0.1450010000000006,-0.6949990000000028
1794,20131016 8:16AM UTC,"Equity Office Inks Four Key Lease Deals at South Station with CVS/pharmacy, Tavern in the Squares Airport-Style Bar, Starbucks and the Return of Beloved Barbaras Books","('CVS pharmacy', 'Tavern in', 'Square  s Airport Style Bar  s Books')",CVS pharmacy,Tavern in,Square  s Airport Style Bar  s Books,CVS pharmacy Tavern in,Tavern in Square  s Airport Style Bar  s Books,CVS pharmacy Tavern in Square  s Airport Style Bar  s Books,-0.31500300000000436,0.6650000000000063
1796,20131017 11:35AM UTC,"Today's Research: Starbucks Corp., The Jones Group Inc., URS Corp., and Republic Airways Holdings Inc.","('Today', 'has', 'Research')",Today,has,Research,Today has,has Research,Today has Research,0.2350009999999969,0.34999899999999684
1797,20131018 4:42PM UTC,Starbucks Announces Q4 and Fiscal Year End 2013 Results Conference Call,"('Starbucks', 'Announces', 'Q4 2013 Results Conference Call')",Starbucks,Announces,Q4 2013 Results Conference Call,Starbucks Announces,Announces Q4 2013 Results Conference Call,Starbucks Announces Q4 2013 Results Conference Call,0.7999989999999997,0.2849999999999966
1798,20131021 6:46PM UTC,Starbucks under media fire in China for high prices,"('media fire', 'is in', 'China')",media fire,is in,China,media fire is in,is in China,media fire is in China,-0.07999799999999624,0.07500100000000032
1799,20131021 6:44PM UTC,UPDATE 1-Starbucks under media fire in China for high prices,"('media fire', 'is in', 'China')",media fire,is in,China,media fire is in,is in China,media fire is in China,-0.07999799999999624,0.07500100000000032
1800,20131021 9:00AM UTC,"Starbucks CelebratesIts First Year Anniversary in India, Reinforcing Long-Term Commitment to the Market with Launch of India Estates Blend","('Its First Year Anniversary', 'is in', 'India')",Its First Year Anniversary,is in,India,Its First Year Anniversary is in,is in India,Its First Year Anniversary is in India,-0.07999799999999624,0.07500100000000032
1801,20131021 5:30AM UTC,RPT-Starbucks under media fire in China for high prices,"('media fire', 'is in', 'China')",media fire,is in,China,media fire is in,is in China,media fire is in China,-0.07999799999999624,0.07500100000000032
1802,20131021 3:20AM UTC,Starbucks under media fire in China for high prices,"('media fire', 'is in', 'China')",media fire,is in,China,media fire is in,is in China,media fire is in China,-0.07999799999999624,0.07500100000000032
1803,20131021 3:15AM UTC,Starbucks under media fire in China for high prices,"('media fire', 'is in', 'China')",media fire,is in,China,media fire is in,is in China,media fire is in China,-0.07999799999999624,0.07500100000000032
1804,20131022 8:00AM UTC,"Restaurants Report Q3 Results, Announce Breakthroughs and Honors - Research Report on Chipotle, Darden, Starbucks, Buffalo Wild Wings, and Domino's Pizza","('Domino', 'has', 'Pizza')",Domino,has,Pizza,Domino has,has Pizza,Domino has Pizza,0.3950010000000006,0.7200010000000034
1805,20131023 4:53PM UTC,Manhattan to get first Teavana tea bar since Starbucks deal,"('Manhattan', 'get', 'first Teavana tea bar')",Manhattan,get,first Teavana tea bar,Manhattan get,get first Teavana tea bar,Manhattan get first Teavana tea bar,0.27499699999999905,-0.4249989999999997
1807,20131023 11:02AM UTC,"Starbucks to open first Teavana store, in New York City","('Starbucks', 'open', 'Teavana store')",Starbucks,open,Teavana store,Starbucks open,open Teavana store,Starbucks open Teavana store,0.27499699999999905,-0.4249989999999997
1808,20131023 10:59AM UTC,"Starbucks to open first Teavana store, in New York City","('Starbucks', 'open', 'Teavana store')",Starbucks,open,Teavana store,Starbucks open,open Teavana store,Starbucks open Teavana store,0.27499699999999905,-0.4249989999999997
1809,20131023 4:52AM UTC,China's netizens defend Starbucks as media brews trouble,"('media', 'brews', 'trouble')",media,brews,trouble,media brews,brews trouble,media brews trouble,0.27499699999999905,-0.4249989999999997
1810,20131024 12:07PM UTC,Starbucks Announces New Date for Q4 and Fiscal Year End 2013 Results Conference Call,"('Starbucks', 'Announces', 'New Date')",Starbucks,Announces,New Date,Starbucks Announces,Announces New Date,Starbucks Announces New Date,-0.5449979999999996,-0.5
1812,20131028 9:05AM UTC,Starbucks Launches Tweet-a-Coffee; Encourages Spontaneous Gifting on Twitter,"('Starbucks', 'Launches ', 'Tweet a-Coffee ')",Starbucks,Launches ,Tweet a-Coffee ,Starbucks Launches ,Launches  Tweet a-Coffee ,Starbucks Launches  Tweet a-Coffee ,0.36499699999999535,-0.625
1813,20131030 9:23PM UTC,Starbucks CEO Schultz resigns from Square Inc's board,"('Square Inc', 'from', 'board')",Square Inc,from,board,Square Inc from,from board,Square Inc from board,0.7099990000000034,0.605000000000004
1814,20131030 9:21PM UTC,Starbucks CEO Schultz resigns from Square Inc's board,"('Square Inc', 'from', 'board')",Square Inc,from,board,Square Inc from,from board,Square Inc from board,0.7099990000000034,0.605000000000004
1815,20131030 7:38PM UTC,"Starbucks 2014 profit forecast falls short, shares drop","('Starbucks 2014 profit forecast', 'falls', 'shares drop')",Starbucks 2014 profit forecast,falls,shares drop,Starbucks 2014 profit forecast falls,falls shares drop,Starbucks 2014 profit forecast falls shares drop,0.7099990000000034,0.605000000000004
1816,20131030 7:38PM UTC,"UPDATE 3-Starbucks 2014 profit forecast falls short, shares drop","('UPDATE 3 Starbucks 2014 profit forecast', 'falls short', 'shares drop')",UPDATE 3 Starbucks 2014 profit forecast,falls short,shares drop,UPDATE 3 Starbucks 2014 profit forecast falls short,falls short shares drop,UPDATE 3 Starbucks 2014 profit forecast falls short shares drop,0.7099990000000034,0.605000000000004
1817,20131030 4:28PM UTC,Starbucks profit rises 34 percent,"('Starbucks profit', 'rises', '34 percent')",Starbucks profit,rises,34 percent,Starbucks profit rises,rises 34 percent,Starbucks profit rises 34 percent,0.7099990000000034,0.605000000000004
1820,20131104 9:45AM UTC,"Expansions, Earnings & Growth Fuel Advancing Fast Casual Restaurants: GRILLiT, Starbucks, Yum! Brands, Wendy's, Chipotle","('Expansions', 'Advancing', 'Fast Casual Restaurants')",Expansions,Advancing,Fast Casual Restaurants,Expansions Advancing,Advancing Fast Casual Restaurants,Expansions Advancing Fast Casual Restaurants,-0.3950000000000031,0.0
1821,20131105 6:52PM UTC,Starbucks to Present at Morgan Stanley Global Consumer Conference,"('Starbucks', 'Present at', 'Morgan Stanley Global Consumer Conference')",Starbucks,Present at,Morgan Stanley Global Consumer Conference,Starbucks Present at,Present at Morgan Stanley Global Consumer Conference,Starbucks Present at Morgan Stanley Global Consumer Conference,-0.19500000000000028,0.8099980000000002
1822,20131105 8:00AM UTC,"Financial Results, Conference Call Schedules, Festive Offerings, E-Gifting Platform - Research Report on Starbucks, Buffalo Wild Wings, Darden, DineEquity, and Bloomin' Brands","('Financial Results', 'Report on', 'Starbucks')",Financial Results,Report on,Starbucks,Financial Results Report on,Report on Starbucks,Financial Results Report on Starbucks,-0.19500000000000028,0.8099980000000002
1823,20131106 5:08PM UTC,"Starbucks wants to recruit 10,000 vets, spouses","('Starbucks', 'wants', 'spouses')",Starbucks,wants,spouses,Starbucks wants,wants spouses,Starbucks wants spouses,1.0150000000000006,-0.4299999999999997
1824,20131106 5:03PM UTC,"UPDATE 1-Starbucks wants to recruit 10,000 vets, spouses","('UPDATE 1 Starbucks', 'wants', 'spouses')",UPDATE 1 Starbucks,wants,spouses,UPDATE 1 Starbucks wants,wants spouses,UPDATE 1 Starbucks wants spouses,1.0150000000000006,-0.4299999999999997
1826,20131106 5:29AM UTC,"Starbucks wants to recruit 10,000 vets, spouses to its ranks","('Starbucks', 'recruit', '10,000 vets')",Starbucks,recruit,"10,000 vets",Starbucks recruit,"recruit 10,000 vets","Starbucks recruit 10,000 vets",1.0150000000000006,-0.4299999999999997
1827,20131106 4:30AM UTC,"Starbucks wants to recruit 10,000 vets, spouses to its ranks","('Starbucks', 'recruit', '10,000 vets')",Starbucks,recruit,"10,000 vets",Starbucks recruit,"recruit 10,000 vets","Starbucks recruit 10,000 vets",1.0150000000000006,-0.4299999999999997
1828,20131106 4:30AM UTC,Starbucks Focuses Hiring Strategy on Veterans and Military Spouses,"('Starbucks', 'Focuses', 'Strategy on Veterans')",Starbucks,Focuses,Strategy on Veterans,Starbucks Focuses,Focuses Strategy on Veterans,Starbucks Focuses Strategy on Veterans,1.0150000000000006,-0.4299999999999997
1831,20131112 6:15PM UTC,Starbucks to pay $2.76 billion in Kraft grocery rift,"('Starbucks', 'pay', '$ 2.76 billion in Kraft grocery rift')",Starbucks,pay,$ 2.76 billion in Kraft grocery rift,Starbucks pay,pay $ 2.76 billion in Kraft grocery rift,Starbucks pay $ 2.76 billion in Kraft grocery rift,-0.21999699999999933,-0.18999900000000025
1834,20131112 4:37PM UTC,Starbucks Concludes Packaged Coffee Dispute with Kraft,"('Starbucks', 'Concludes Coffee Dispute with', 'Kraft')",Starbucks,Concludes Coffee Dispute with,Kraft,Starbucks Concludes Coffee Dispute with,Concludes Coffee Dispute with Kraft,Starbucks Concludes Coffee Dispute with Kraft,-0.21999699999999933,-0.18999900000000025
1835,20131112 3:01AM UTC,"Starbucks Creates Wonder, Shares Joy with Customers this Holiday Season","('Starbucks', 'Creates', 'Shares Joy')",Starbucks,Creates,Shares Joy,Starbucks Creates,Creates Shares Joy,Starbucks Creates Shares Joy,-0.21999699999999933,-0.18999900000000025
1837,20131113 6:00PM UTC,Starbucks eyes more German store openings in European push,"('German store openings', 'is in', 'European push')",German store openings,is in,European push,German store openings is in,is in European push,German store openings is in European push,-0.7600020000000001,0.42499999999999716
1838,20131113 6:00PM UTC,Starbucks eyes more German store openings in European push,"('German store openings', 'is in', 'European push')",German store openings,is in,European push,German store openings is in,is in European push,German store openings is in European push,-0.7600020000000001,0.42499999999999716
1843,20131113 9:39AM UTC,CORRECTED-UPDATE 1-Starbucks to restate results to show loss from Kraft damages,"('results', 'show', 'loss')",results,show,loss,results show,show loss,results show loss,-0.7600020000000001,0.42499999999999716
1845,20131113 7:07AM UTC,Starbucks to restate results to show loss from Kraft damages,"('results', 'show', 'loss')",results,show,loss,results show,show loss,results show loss,-0.7600020000000001,0.42499999999999716
1847,20131115 2:48PM UTC,Starbucks loses 'Charbucks' appeal,"('Starbucks', 'loses', 'Charbucks')",Starbucks,loses,Charbucks,Starbucks loses,loses Charbucks,Starbucks loses Charbucks,-0.139998999999996,0.02500100000000316
1848,20131115 2:22PM UTC,UPDATE 1-Starbucks loses 'Charbucks' appeal,"('UPDATE 1 Starbucks', 'loses', 'appeal')",UPDATE 1 Starbucks,loses,appeal,UPDATE 1 Starbucks loses,loses appeal,UPDATE 1 Starbucks loses appeal,-0.139998999999996,0.02500100000000316
1849,20131115 12:43PM UTC,Starbucks loses 'Charbucks' appeal,"('Starbucks', 'loses', 'Charbucks')",Starbucks,loses,Charbucks,Starbucks loses,loses Charbucks,Starbucks loses Charbucks,-0.139998999999996,0.02500100000000316
1850,20131121 9:30AM UTC,"Sotheby's, Sally Beauty Holdings, Green Mountain Coffee Roasters, Treehouse Foods and Starbucks highlighted as Zacks Bull and Bear of the Day","('Sally Beauty Holdings', 'highlighted as', 'Zacks Bull')",Sally Beauty Holdings,highlighted as,Zacks Bull,Sally Beauty Holdings highlighted as,highlighted as Zacks Bull,Sally Beauty Holdings highlighted as Zacks Bull,-0.16499699999999962,0.9199979999999925
1851,20131122 8:01AM UTC,Starbucks Continues Expansion in India with the Opening of the Much Anticipated Flagship Store in the Beautiful Garden City of Bangalore,"('Starbucks', 'Continues Expansion with', 'Opening')",Starbucks,Continues Expansion with,Opening,Starbucks Continues Expansion with,Continues Expansion with Opening,Starbucks Continues Expansion with Opening,0.9499959999999987,-0.0899999999999963
1852,20131130 6:30AM UTC,Help Deliver an AIDS-Free Generation on World AIDS Day with Your Purchase at Starbucks,"('Help', 'Deliver AIDS Free Generation on', 'World AIDS Day')",Help,Deliver AIDS Free Generation on,World AIDS Day,Help Deliver AIDS Free Generation on,Deliver AIDS Free Generation on World AIDS Day,Help Deliver AIDS Free Generation on World AIDS Day,0.2299989999999994,-0.08000100000000288
1856,20131203 8:00AM UTC,"Restos Announce Financial Results, New Promos and Joint Venture Expansions - Research Report on Starbucks, Yum! Brands, Panera Bread, Cracker Barrel, and Bloomin' Brands","('Financial Results', 'Restos', 'Joint Venture Expansions Research Report')",Restos,Announce,Financial Results,Restos Announce,Announce Financial Results,Restos Announce Financial Results,0.2299989999999994,-0.08000100000000288
1858,20131212 9:05PM UTC,Starbucks CEO Howard Schultz Commends House of Representatives on Budget Approval,"('Starbucks CEO Howard Schultz', 'Commends', 'House of Representatives')",Starbucks CEO Howard Schultz,Commends,House of Representatives,Starbucks CEO Howard Schultz Commends,Commends House of Representatives,Starbucks CEO Howard Schultz Commends House of Representatives,0.2299989999999994,-0.08000100000000288
1859,20131212 4:09PM UTC,Insight: China CCTV Starbucks report set off storm inside network,"('China CCTV Starbucks report', 'set off storm inside', 'network')",China CCTV Starbucks report,set off storm inside,network,China CCTV Starbucks report set off storm inside,set off storm inside network,China CCTV Starbucks report set off storm inside network,0.2299989999999994,-0.08000100000000288
1860,20131212 4:01PM UTC,INSIGHT-China CCTV Starbucks report set off storm inside network,"('China CCTV Starbucks report', 'set off storm inside', 'network')",China CCTV Starbucks report,set off storm inside,network,China CCTV Starbucks report set off storm inside,set off storm inside network,China CCTV Starbucks report set off storm inside network,0.2299989999999994,-0.08000100000000288
1862,20131219 11:00AM UTC,"New 2 Hour Educational Learning Labs at MD&M; West Will Feature Baxter Bioscience, BMW, Dell, GE Healthcare, Mattel, Northrup Grumman, Starbucks and Other Leading Groups in Design, Manufacturing, Engineering and Automation","('West Will Feature Baxter Bioscience', 'Starbucks in', 'Design')",West Will Feature Baxter Bioscience,Starbucks in,Design,West Will Feature Baxter Bioscience Starbucks in,Starbucks in Design,West Will Feature Baxter Bioscience Starbucks in Design,0.2299989999999994,-0.08000100000000288
1863,20131220 3:00PM UTC,"Just in Time for the Holidays, Starbucks Offers Beyoncs Self-Titled Album","('Starbucks', 'Offers Beyonc in', 'Time for Holidays')",Starbucks,Offers Beyonc in,Time for Holidays,Starbucks Offers Beyonc in,Offers Beyonc in Time for Holidays,Starbucks Offers Beyonc in Time for Holidays,0.2299989999999994,-0.08000100000000288
1865,20131227 8:00AM UTC,"Services Sector Announce Disaster Relief Donations and New Leadership Appointments - Research Report on McDonald's, Starbucks, Yum! Brands, Chipotle, and Brinker","('Services Sector', 'Announce', 'Disaster Relief Donations')",Services Sector,Announce,Disaster Relief Donations,Services Sector Announce,Announce Disaster Relief Donations,Services Sector Announce Disaster Relief Donations,0.2299989999999994,-0.08000100000000288
1866,20140103 9:00AM UTC,Starbucks Expands Starbucks Cards to China in Time for the Lunar New Year,"('Starbucks', 'Expands Starbucks Cards in', 'Time')",Starbucks,Expands Starbucks Cards in,Time,Starbucks Expands Starbucks Cards in,Expands Starbucks Cards in Time,Starbucks Expands Starbucks Cards in Time,0.2299989999999994,-0.08000100000000288
